{
  "schemaVersion": 1,
  "source": {
    "kind": "canonical-ui-scene",
    "source": {
      "visualBaseline": "http://127.0.0.1:43173/outputs/coremail-mail-home-v5/",
      "stateId": "coremail-inbox-expanded-default-v6",
      "purpose": "cross-renderer-complex-structure-benchmark"
    }
  },
  "page": {
    "name": "Text-to-UI / Complex Structure Benchmark",
    "targetPage": "coremail",
    "viewport": {
      "width": 1000,
      "height": 520
    },
    "pattern": "pattern-b-three-pane",
    "stateScope": "default-visible"
  },
  "resources": {
    "componentLibraryPage": "NewComponents",
    "variableAliases": {
      "layout/primary-width": "layout/width/240",
      "border/subtle": "neutral-dark/05",
      "size/titlebar": "size/64",
      "text/primary": "neutral-dark/90",
      "size/control": "size/40",
      "size/icon": "size/20",
      "icon/primary": "brand/100",
      "text/secondary": "neutral-dark/60",
      "icon/default": "neutral-dark/90",
      "layout/secondary-width": "layout/width/360",
      "text/muted": "neutral-dark/40"
    },
    "variables": [
      {
        "collection": "Color",
        "mode": "Light",
        "name": "neutral-light/100",
        "ref": "$variable/neutral-light/100",
        "value": "#FFFFFFFF"
      },
      {
        "collection": "Size & Layout",
        "mode": "Desktop",
        "name": "radius/16",
        "ref": "$variable/radius/16",
        "value": 16
      },
      {
        "collection": "Size & Layout",
        "mode": "Desktop",
        "name": "layout/width/240",
        "ref": "$variable/layout/width/240",
        "value": 240
      },
      {
        "collection": "Color",
        "mode": "Light",
        "name": "neutral-dark/05",
        "ref": "$variable/neutral-dark/05",
        "value": "#0000000C"
      },
      {
        "collection": "Size & Layout",
        "mode": "Desktop",
        "name": "size/64",
        "ref": "$variable/size/64",
        "value": 64
      },
      {
        "collection": "Spacing",
        "mode": "Compact",
        "name": "space/5",
        "ref": "$variable/space/5",
        "value": 16
      },
      {
        "collection": "Color",
        "mode": "Light",
        "name": "neutral-dark/90",
        "ref": "$variable/neutral-dark/90",
        "value": "#000000E5"
      },
      {
        "collection": "Spacing",
        "mode": "Compact",
        "name": "space/4",
        "ref": "$variable/space/4",
        "value": 12
      },
      {
        "collection": "Spacing",
        "mode": "Compact",
        "name": "space/2",
        "ref": "$variable/space/2",
        "value": 4
      },
      {
        "collection": "Size & Layout",
        "mode": "Desktop",
        "name": "size/40",
        "ref": "$variable/size/40",
        "value": 40
      },
      {
        "collection": "Spacing",
        "mode": "Compact",
        "name": "space/3",
        "ref": "$variable/space/3",
        "value": 8
      },
      {
        "collection": "Color",
        "mode": "Light",
        "name": "brand/10",
        "ref": "$variable/brand/10",
        "value": "#0A59F719"
      },
      {
        "collection": "Size & Layout",
        "mode": "Desktop",
        "name": "radius/08",
        "ref": "$variable/radius/08",
        "value": 8
      },
      {
        "collection": "Size & Layout",
        "mode": "Desktop",
        "name": "size/20",
        "ref": "$variable/size/20",
        "value": 20
      },
      {
        "collection": "Color",
        "mode": "Light",
        "name": "brand/100",
        "ref": "$variable/brand/100",
        "value": "#0A59F7FF"
      },
      {
        "collection": "Color",
        "mode": "Light",
        "name": "neutral-dark/60",
        "ref": "$variable/neutral-dark/60",
        "value": "#00000099"
      },
      {
        "collection": "Size & Layout",
        "mode": "Desktop",
        "name": "layout/width/360",
        "ref": "$variable/layout/width/360",
        "value": 360
      },
      {
        "collection": "Color",
        "mode": "Light",
        "name": "neutral-dark/40",
        "ref": "$variable/neutral-dark/40",
        "value": "#00000066"
      },
      {
        "collection": "Spacing",
        "mode": "Compact",
        "name": "space/6",
        "ref": "$variable/space/6",
        "value": 24
      }
    ],
    "styles": [
      {
        "ref": "$style/Effect/Foundation/shadow-2",
        "role": "shadow-2"
      },
      {
        "ref": "$style/Typography/Subtitle_M",
        "role": "subtitle-m"
      },
      {
        "ref": "$style/Typography/Body_L",
        "role": "body-l"
      },
      {
        "ref": "$style/Typography/Body_M",
        "role": "body-m"
      },
      {
        "ref": "$style/Typography/Title_S",
        "role": "title-s"
      },
      {
        "ref": "$style/Typography/Title_M",
        "role": "title-m"
      }
    ],
    "icons": [
      {
        "alias": "navigation/inbox",
        "source": "lucide",
        "name": "inbox",
        "svg": "<svg xmlns=\"http://www.w3.org/2000/svg\" viewBox=\"0 0 24 24\" fill=\"none\" stroke=\"currentColor\" stroke-width=\"1.5\" stroke-linecap=\"round\" stroke-linejoin=\"round\"><polyline points=\"22 12 16 12 14 15 10 15 8 12 2 12\"/><path d=\"M5.45 5.11 2 12v6a2 2 0 0 0 2 2h16a2 2 0 0 0 2-2v-6l-3.45-6.89A2 2 0 0 0 16.76 4H7.24a2 2 0 0 0-1.79 1.11z\"/></svg>"
      },
      {
        "alias": "navigation/mail-unread",
        "source": "lucide",
        "name": "mail-open",
        "svg": "<svg xmlns=\"http://www.w3.org/2000/svg\" viewBox=\"0 0 24 24\" fill=\"none\" stroke=\"currentColor\" stroke-width=\"1.5\" stroke-linecap=\"round\" stroke-linejoin=\"round\"><path d=\"M21.2 8.4c.5.38.8.97.8 1.6v10a2 2 0 0 1-2 2H4a2 2 0 0 1-2-2V10a2 2 0 0 1 .8-1.6l8-6a2 2 0 0 1 2.4 0l8 6Z\"/><path d=\"m22 10-8.97 5.7a1.94 1.94 0 0 1-2.06 0L2 10\"/></svg>"
      },
      {
        "alias": "field/search",
        "source": "lucide",
        "name": "search",
        "svg": "<svg xmlns=\"http://www.w3.org/2000/svg\" viewBox=\"0 0 24 24\" fill=\"none\" stroke=\"currentColor\" stroke-width=\"1.5\" stroke-linecap=\"round\" stroke-linejoin=\"round\"><path d=\"m21 21-4.34-4.34\"/><circle cx=\"11\" cy=\"11\" r=\"8\"/></svg>"
      }
    ],
    "font": "font/family/sans"
  },
  "nodes": [
    {
      "id": "benchmark-root",
      "name": "Complex structure benchmark",
      "type": "frame",
      "region": "global",
      "layout": {
        "direction": "HORIZONTAL",
        "width": 1000,
        "height": 520,
        "padding": {},
        "gap": null,
        "primaryAlign": "MIN",
        "counterAlign": "MIN",
        "distribution": "PACKED",
        "align": "MIN",
        "clipsContent": true
      },
      "style": {
        "fill": {
          "tokenRef": "neutral-light/100",
          "variableRef": "$variable/neutral-light/100",
          "ref": "$variable/neutral-light/100",
          "name": "neutral-light/100",
          "value": "#FFFFFFFF",
          "kind": "token"
        },
        "radius": {
          "tokenRef": "radius/16",
          "variableRef": "$variable/radius/16",
          "ref": "$variable/radius/16",
          "name": "radius/16",
          "value": 16
        },
        "effectStyle": {
          "ref": "$style/Effect/Foundation/shadow-2",
          "role": "shadow-2"
        }
      },
      "metadata": {
        "source": "canonical-ui-scene",
        "region": "global"
      },
      "children": [
        {
          "id": "benchmark-primary",
          "name": "Primary navigation pane",
          "type": "frame",
          "region": "primary-navigation",
          "layout": {
            "direction": "VERTICAL",
            "width": {
              "tokenRef": "layout/primary-width",
              "variableRef": "$variable/layout/width/240",
              "ref": "$variable/layout/width/240",
              "name": "layout/width/240",
              "value": 240
            },
            "height": "fill",
            "padding": {},
            "gap": null,
            "primaryAlign": "MIN",
            "counterAlign": "MIN",
            "distribution": "PACKED",
            "align": "MIN",
            "clipsContent": true
          },
          "style": {
            "fill": {
              "tokenRef": "neutral-dark/05",
              "variableRef": "$variable/neutral-dark/05",
              "ref": "$variable/neutral-dark/05",
              "name": "neutral-dark/05",
              "value": "#0000000C",
              "kind": "token"
            },
            "stroke": {
              "tokenRef": "border/subtle",
              "variableRef": "$variable/neutral-dark/05",
              "ref": "$variable/neutral-dark/05",
              "name": "neutral-dark/05",
              "value": "#0000000C"
            }
          },
          "metadata": {
            "source": "canonical-ui-scene",
            "region": "primary-navigation"
          },
          "children": [
            {
              "id": "benchmark-primary-titlebar",
              "name": "Primary Titlebar",
              "type": "component",
              "region": "primary-navigation",
              "layout": {
                "direction": "HORIZONTAL",
                "width": "fill",
                "height": {
                  "tokenRef": "size/titlebar",
                  "variableRef": "$variable/size/64",
                  "ref": "$variable/size/64",
                  "name": "size/64",
                  "value": 64
                },
                "padding": {
                  "left": {
                    "tokenRef": "space/5",
                    "variableRef": "$variable/space/5",
                    "ref": "$variable/space/5",
                    "name": "space/5",
                    "value": 16
                  },
                  "right": {
                    "tokenRef": "space/5",
                    "variableRef": "$variable/space/5",